{
  "$schema": "http://json-schema.org/draft-07/schema#",
  "title": "SafeSOC ground_truth",
  "description": "Per-case answer key for the SafeSOC offline evaluator, rubric v1.1. Verdict, severity, and action bands follow one condition-level policy across both splits.",
  "type": "object",
  "required": [
    "case_id", "evidence_condition", "calibration_role", "correct_verdict",
    "acceptable_severity", "acceptable_actions", "grounding", "the_trap",
    "rationale", "annotated_by", "review_status", "rubric_version"
  ],
  "properties": {
    "case_id": {"type": "string"},
    "security_proposition": {
      "type": "string",
      "minLength": 1,
      "description": "Optional research metadata stating the security-relevant proposition the case resolves; not consumed by C1-C4."
    },
    "evidence_condition": {"enum": ["strong", "weak", "missing", "counter"]},
    "calibration_role": {"enum": ["preserve", "up_rank", "down_rank"]},
    "correct_verdict": {"enum": ["malicious", "suspicious", "benign"]},
    "acceptable_severity": {
      "type": "array", "minItems": 1,
      "items": {"enum": ["informational", "low", "medium", "high", "critical"]},
      "description": "The severity band C2 checks the LLM against (a range, not a point)."
    },
    "grounding": {
      "type": "object",
      "required": ["supporting_evidence", "counter_evidence", "must_not_assert"],
      "properties": {
        "supporting_evidence": {"type": "array", "items": {"type": "string"},
          "description": "Evidence ids (A0/EV-xxx) that warrant the correct verdict."},
        "counter_evidence": {"type": "array", "items": {"type": "string"},
          "description": "Benign/contradicting evidence ids the LLM must heed (C3)."},
        "must_not_assert": {"type": "array", "items": {"type": "string"},
          "description": "Absent facts the LLM must not claim (C1; mainly for 'missing' cases)."}
      },
      "additionalProperties": false
    },
    "acceptable_actions": {
      "type": "array", "minItems": 1, "uniqueItems": true,
      "items": {"enum": ["close_benign", "monitor", "investigate", "escalate", "isolate"]},
      "description": "The bidirectional action band C4 checks against. The band is fixed by evidence condition."
    },
    "operational_response": {
      "type": "object",
      "description": "Optional deployment metadata; it does not expand or replace the five-value C4 action band.",
      "required": ["family", "note"],
      "properties": {
        "family": {
          "enum": [
            "none", "analyst_escalation", "endpoint_isolation",
            "credential_control", "network_blocking"
          ]
        },
        "note": {"type": "string", "minLength": 1}
      },
      "additionalProperties": false
    },
    "the_trap": {"type": "string", "description": "One line: the specific over/under-triage failure this case probes."},
    "rationale": {"type": "string", "description": "Annotator's evidence -> verdict justification, tied to the rubric."},
    "annotated_by": {"type": "string"},
    "review_status": {
      "oneOf": [
        {"const": "reviewed_for_benchmark_v1.1"},
        {"type": "string", "pattern": "^frozen_pre_model_[0-9]{4}-[0-9]{2}-[0-9]{2}$"}
      ],
      "description": "Either canonical benchmark review or a dated pre-model freeze; status metadata is not consumed by C1-C4."
    },
    "rubric_version": {"const": "1.1"}
  },
  "additionalProperties": false
}
